Bussines Type,Bussines Name,Bussines Description,Bussines Address,Bussines Hours ,Bussines Phone ,Bussines Website ,Bussines Rating,Bussines Reviews
Gym,Star gym,Not Available,"PXCP+5GF, Mohalla Jhimpir, Choa Saidan Shah, Chakwal, Punjab, Pakistan",Open 24 hours,+92 348 5563478,Not Available,2.5,2
Gym,Shinkyokushin Karate Second Time Class.,Not Available,"PXMV+R5X, Choa Saidan Shah, Chakwal, Punjab, Pakistan",Closed ⋅ Opens 5 PM,+92 340 5957435,Not Available,5,4
Gym,Relax zone beauty saloon and fittness center,Not Available,"PXCH+MXV, Kalar Kahar Rd, Choa Saidan Shah, Chakwal, Punjab, Pakistan",Closed ⋅ Opens 9 AM,+92 345 9828866,Not Available,Not Available,Not Available
Gym,Royal GYM,Not Available,"PVGJ+P8V, Choa Saidan Shah, Chakwal, Punjab, Pakistan",Not Available,+92 340 5763264,Not Available,Not Available,Not Available
Gym,Tennis Court,Not Available,"J2Q8+M3W, ICI Officer Colony Rd, ICI Officers Colony Khewra, Jhelum, Punjab, Pakistan",Open 24 hours,+971 50 789 3122,Not Available,4.7,3
Gym,Badminton Court,Not Available,"PX8P+6Q7, Mateen Mohalla, Choa Saidan Shah, Chakwal, Punjab, Pakistan",Not Available,Not Available,Not Available,Not Available,Not Available
Gym,Askari Fitness Zone,Not Available,"QPM3+63R, Akari Cadet Collage, Kacha Pakka, Kallar Kahar, Chakwal, Punjab, Pakistan",Open 24 hours,+92 334 5018743,Not Available,5,2
Gym,Wanhar Fitness Club,Not Available,"PM45+QJR, Khushab Road, Kallar Kahar, Chakwal, Punjab, Pakistan",Closed ⋅ Opens 8 AM,+92 334 4334494,Not Available,5,4
Gym,Arnold Gym Club,Not Available,"VQ66+5QF, Road, Bhaun, Chakwal, Punjab 48520, Pakistan",Not Available,Not Available,Not Available,Not Available,Not Available
Gym,Chabber,Not Available,"RJJ8+V2Q, Hattar, Chakwal, Punjab, Pakistan",Not Available,+92 348 5608598,Not Available,Not Available,Not Available
Gym,Ajaz Minhas Agriculture,Not Available,"Malicks Road, Chakwal, Punjab, Pakistan",Not Available,Not Available,Not Available,5,1
Gym,Body Works,Not Available,"WVJ6+54Q, Hospital Rd, Chakwal, Punjab, Pakistan",Closed ⋅ Opens 4 AM,+92 332 0533934,Not Available,5,4
Gym,NAWAB KHAIL STADIUM,Not Available,"WQ9V+JVF, Chakwal, Punjab, Pakistan",Not Available,Not Available,Not Available,4.5,2
Personal trainer,Fitness Trainer Chakwal,Not Available,"Opposite Tehsil Office Zila Council Plaza Tehsil Chowk, Chakwal, Punjab 48800, Pakistan",Not Available,+92 310 5912866,Not Available,Not Available,Not Available
Physical therapy clinic,Tafazal Physiotherapy Clinic kallar kahar,Not Available,"Chakwal Road, Kallar Kahar, Chakwal, Punjab 48530, Pakistan",Closed ⋅ Opens 8 AM,+92 311 0159069,https://tafazal-physiotherapy-clinic-kallar-kahar.business.site/?utm_source=gmb&utm_medium=referral,5,2
School,Askari Cadet College Kallar Kahar,Not Available,"QMMR+MCV, Mohalla Mohra, Kallar Kahar, Chakwal, Punjab, Pakistan",Open 24 hours,+92 333 5111185,http://askaricadetcollege.edu.pk/,4.2,25
Mosque,Eid gah bhaun,Not Available,"VQ34+R24, Kallar Kahar Road, Bhaun, Chakwal, Punjab, Pakistan",Not Available,Not Available,Not Available,5,3
Gym,Get Fit Pakistan,Not Available,"3rd Floor, Vogue Towers, MM Alam Rd, Block C 2 Gulberg III, Lahore, Punjab 54000, Pakistan",Closed ⋅ Opens 10 AM,+92 320 5656910,http://www.getfituae.com/,4.2,31
Market,Haji Buland khan Market,Not Available,"VQ66+4PR, Bhaun, Chakwal, Punjab, Pakistan",Closed ⋅ Opens 8 AM,Not Available,Not Available,3.7,3
Gym,Atmosphere Fitness Pvt. Ltd.,Not Available,"Old Queens Road, off I.I Chundrigar Rd, City Railway Colony, Karachi, Karachi City, Sindh, Pakistan",Closed ⋅ Opens 7 AM,+92 21 32400201,http://www.atmosphere.com.pk/,4.7,235
Physical fitness program,Gym Passport,Not Available,Not Available,Open 24 hours,+92 342 4267060,https://gympassport.pk/,5,1
Mosque,MASJID CHADRA WAALI,Not Available,"VQ55+C3H, Bhaun, Chakwal, Punjab, Pakistan",Not Available,Not Available,Not Available,4.3,10
Fitness center,Get Smart Gym Ph1,Not Available,"Golden Tower, Main Korangi Road, DHA phase 1, Phase 1 Defence Housing Authority, Karachi, Karachi City, Sindh 75500, Pakistan",Closed ⋅ Opens 6 AM,+92 21 35397849,http://www.chainofgetsmartgym.com/,4.2,358
Gym,Get Smart Gym Garden,Not Available,"Plot No.322-B, Nishtar Road, Garden, next to PSO Petrol Pump, Chapra Square, Karachi, Karachi City, Sindh, Pakistan",Closed ⋅ Opens 6 AM,+92 21 32291223,https://www.facebook.com/chainofgetsmartgymofficialpage,4.4,57
Repair service,Hamza electric & repairing center,Not Available,"Bhaun, Chakwal, Punjab 00786, Pakistan",Closed ⋅ Opens 8 AM,+92 335 8301814,Not Available,5,2
Book store,Imran Book Depot,Not Available,"Main Bus Stop، VQ66+28H Main Bazar, street, Bhaun, Pakistan",Closed ⋅ Opens 7:30 PM,+92 303 5926896,Not Available,5,5
Gym,Get Smart Gym Mochi Mor,Not Available,"Plot#C-11, near Mochi Mor, Block 13D Block 13 D Gulshan-e-Iqbal, Karachi, Karachi City, Sindh, Pakistan",Closed ⋅ Opens 6:30 AM,+92 21 33383378,http://www.chainofgetsmartgym.com/,4.7,19
Wholesaler,Royaltags9,Not Available,"Tehsil & District, Chakwal, 48700, Pakistan",Not Available,+92 340 9587680,https://www.royaltags9.com/,Not Available,Not Available
Shopping mall,"Utility Store, Miani Adda",Not Available,"Khushab Road, Miani Adda, Chakwal, Punjab, Pakistan",Closed ⋅ Opens 8 AM,Not Available,http://www.usc.org.pk/,3.7,28
Sportswear store,Gym Armour,Not Available,"91-G3, Lahore, Pakistan",Closed ⋅ Opens 10 AM Mon,+92 313 8466444,http://www.gymarmour.co/,3.7,26
Place of worship,Masjid Shehawali Moh Kot,Not Available,"VQ54+4MC, Bhaun, Chakwal, Punjab, Pakistan",Not Available,Not Available,Not Available,Not Available,Not Available
Gas station,Zohaib gas agency,Not Available,"VQ66+6MW, Bhaun, Chakwal, Punjab, Pakistan",Not Available,+92 342 5001439,Not Available,5,2
Mosque,Jamia Majid aqsa ehlehdes,Not Available,"VQ64+X6P, Mohalla Islamabad Rd, Bhaun, Chakwal, Punjab, Pakistan",Not Available,+92 311 6521004,Not Available,Not Available,Not Available
Gym,Jane's Gym Fitness For Women,Not Available,"4850 Goodman Rd, Olive Branch, MS 38654",Closes soon ⋅ 3 PM ⋅ Opens 8 AM Sat,(662) 893-5263,http://www.janesgym.com/,4.5,151
Repair service,Master of Fitness Equipment,Not Available,"Madina Town, Bharaku, Islamabad, Islamabad Capital Territory 46010, Pakistan",Closed ⋅ Opens 9 AM,+92 300 9855546,http://www.mfitnessequipment.com/,5,17
Fitness center,Ithaca College Fitness Center,Not Available,"Ithaca, NY 14850",Open ⋅ Closes 8 PM,(607) 274-3399,http://www.ithaca.edu/sacl/recsports/fitnesscenter/,4.7,23
Gym,PWRBLD Gym,Not Available,"544 E Elm St, Conshohocken, PA 19428",Open 24 hours,(484) 231-1252,http://pwrbldgym.com/,4.9,180
Gym,Cecil Garcia Fitness Center,Not Available,"700 Old Zuni Rd, Gallup, NM 87301",Open ⋅ Closes 8 PM,(505) 722-7271,http://www.gallupnm.gov/index.aspx?NID=202,4.3,70
Gym,Gymies Fitness Center,Not Available,"47 W Jackson St, Cicero, IN 46034",Open 24 hours,(317) 984-3399,http://www.gymiesfitness.com/,4.9,25
Gym,Elev8 Gym,Not Available,"11160 Rojas Dr, El Paso, TX 79935",Open ⋅ Closes 9 PM,(915) 591-6000,http://elev8gym.com/,4.6,88
Gym,Takedown Gym,Not Available,"17192 MN-371, Brainerd, MN 56401",Open ⋅ Closes 7 PM,(218) 454-1770,http://www.takedowngym.com/,4.9,90
Gym,World Gym,Not Available,"9481Princeton, Glendale Road, Hamilton, OH 45011",Open 24 hours,(513) 790-6168,https://www.worldgym.com/westchester/?utm_source=GMB&utm_medium=organic&utm_campaign=Hamilton,4.7,164
Gym,Buckley Fitness Center,Not Available,"Aurora, CO 80011",Open ⋅ Closes 9 PM,(720) 847-6679,https://www.460fss.com/fitness-center/,4.4,155
Gym,Santa Fe Health & Fitness,"Members-only gym for fitness & bootcamps. Traditional, members-only gym offering fitness bootcamp & group classes, plus personal training.","2008 St Michaels Dr, Santa Fe, NM 87505",Open ⋅ Closes 7 PM,(505) 795-7742,http://nmsportsfitness.com/,4.6,84
Gym,Gaffney Fitness Center,Not Available,"6330 Broad Foot Rd, Fort Meade, MD 20755",Open ⋅ Closes 7 PM,(301) 677-3716,https://meade.armymwr.com/programs/gaffney-fitness-center,4.2,400
Fitness center,The Gym Ramona,Not Available,"558 Main St, Ramona, CA 92065",Open ⋅ Closes 10:30 PM,(760) 789-3500,http://www.ramonafitness.com/,4.4,83
